vagrant@webserver:~$ tshark -r /vagrant/webserver-eth0-traffic2.pcap
  1 0.000000000    10.0.2.15 -> 90.130.70.73 TCP 74 48471→21 [SYN] Seq=0 Win=29200 Len=0 MSS=1460 SACK_PERM=1 TSval=4222193 TSecr=0 WS=64
  2 0.139973000 90.130.70.73 -> 10.0.2.15    TCP 60 21→48471 [SYN, ACK] Seq=0 Ack=1 Win=65535 Len=0 MSS=1460
  3 0.140004000    10.0.2.15 -> 90.130.70.73 TCP 54 48471→21 [ACK] Seq=1 Ack=1 Win=1868800 Len=0
  4 0.285434000 90.130.70.73 -> 10.0.2.15    FTP 74 Response: 220 (vsFTPd 3.0.3)
  5 0.285528000    10.0.2.15 -> 90.130.70.73 TCP 54 48471→21 [ACK] Seq=1 Ack=21 Win=1868800 Len=0
  6 26.168611000    10.0.2.15 -> 90.130.70.73 FTP 70 Request: USER anonymous
  7 26.168961000 90.130.70.73 -> 10.0.2.15    TCP 60 21→48471 [ACK] Seq=21 Ack=17 Win=65535 Len=0
  8 26.305847000 90.130.70.73 -> 10.0.2.15    FTP 88 Response: 331 Please specify the password.
  9 26.305963000    10.0.2.15 -> 90.130.70.73 TCP 54 48471→21 [ACK] Seq=17 Ack=55 Win=1868800 Len=0
 10 35.799632000    10.0.2.15 -> 90.130.70.73 FTP 67 Request: PASS anyant
 11 35.799976000 90.130.70.73 -> 10.0.2.15    TCP 60 21→48471 [ACK] Seq=55 Ack=30 Win=65535 Len=0
 12 36.019894000 90.130.70.73 -> 10.0.2.15    FTP 77 Response: 230 Login successful.
 13 36.020112000    10.0.2.15 -> 90.130.70.73 TCP 54 48471→21 [ACK] Seq=30 Ack=78 Win=1868800 Len=0
 14 36.020394000    10.0.2.15 -> 90.130.70.73 FTP 60 Request: SYST
 15 36.020829000 90.130.70.73 -> 10.0.2.15    TCP 60 21→48471 [ACK] Seq=78 Ack=36 Win=65535 Len=0
 16 36.159807000 90.130.70.73 -> 10.0.2.15    FTP 73 Response: 215 UNIX Type: L8
 17 36.197482000    10.0.2.15 -> 90.130.70.73 TCP 54 48471→21 [ACK] Seq=36 Ack=97 Win=1868800 Len=0
 18 51.939670000    10.0.2.15 -> 90.130.70.73 FTP 60 Request: QUIT
 19 51.939997000 90.130.70.73 -> 10.0.2.15    TCP 60 21→48471 [ACK] Seq=97 Ack=42 Win=65535 Len=0
 20 52.077021000 90.130.70.73 -> 10.0.2.15    FTP 68 Response: 221 Goodbye.
 21 52.077049000 90.130.70.73 -> 10.0.2.15    TCP 60 21→48471 [FIN, ACK] Seq=111 Ack=42 Win=65535 Len=0
 22 52.077128000    10.0.2.15 -> 90.130.70.73 TCP 54 48471→21 [ACK] Seq=42 Ack=111 Win=1868800 Len=0
 23 52.077522000    10.0.2.15 -> 90.130.70.73 TCP 54 48471→21 [FIN, ACK] Seq=42 Ack=112 Win=1868800 Len=0
 24 52.077976000 90.130.70.73 -> 10.0.2.15    TCP 60 21→48471 [ACK] Seq=112 Ack=43 Win=65535 Len=0
