vagrant@webserver:~$ tshark -r /vagrant/webserver-eth0-traffic3.pcap
  1 0.000000000    10.0.2.15 -> 172.217.8.67 TCP 74 38988→80 [SYN] Seq=0 Win=29200 Len=0 MSS=1460 SACK_PERM=1 TSval=4370840 TSecr=0 WS=64
  2 0.032926000 172.217.8.67 -> 10.0.2.15    TCP 60 80→38988 [SYN, ACK] Seq=0 Ack=1 Win=65535 Len=0 MSS=1460
  3 0.032982000    10.0.2.15 -> 172.217.8.67 TCP 54 38988→80 [ACK] Seq=1 Ack=1 Win=1868800 Len=0
  4 0.033896000    10.0.2.15 -> 172.217.8.67 HTTP 165 GET / HTTP/1.1
  5 0.034338000 172.217.8.67 -> 10.0.2.15    TCP 60 80→38988 [ACK] Seq=1 Ack=112 Win=65535 Len=0
  6 0.107766000 172.217.8.67 -> 10.0.2.15    TCP 2914 [TCP segment of a reassembled PDU]
  7 0.107795000    10.0.2.15 -> 172.217.8.67 TCP 54 38988→80 [ACK] Seq=112 Ack=2861 Win=2181120 Len=0
  8 0.110507000 172.217.8.67 -> 10.0.2.15    TCP 1484 [TCP segment of a reassembled PDU]
  9 0.110538000    10.0.2.15 -> 172.217.8.67 TCP 54 38988→80 [ACK] Seq=112 Ack=4291 Win=2362880 Len=0
 10 0.112395000 172.217.8.67 -> 10.0.2.15    TCP 1484 [TCP segment of a reassembled PDU]
 11 0.112402000    10.0.2.15 -> 172.217.8.67 TCP 54 38988→80 [ACK] Seq=112 Ack=5721 Win=2544640 Len=0
 12 0.114275000 172.217.8.67 -> 10.0.2.15    TCP 1484 [TCP segment of a reassembled PDU]
 13 0.114283000    10.0.2.15 -> 172.217.8.67 TCP 54 38988→80 [ACK] Seq=112 Ack=7151 Win=2726400 Len=0
 14 0.116513000 172.217.8.67 -> 10.0.2.15    TCP 1484 [TCP segment of a reassembled PDU]
 15 0.116519000    10.0.2.15 -> 172.217.8.67 TCP 54 38988→80 [ACK] Seq=112 Ack=8581 Win=2908160 Len=0
 16 0.118488000 172.217.8.67 -> 10.0.2.15    TCP 1484 [TCP segment of a reassembled PDU]
 17 0.118497000    10.0.2.15 -> 172.217.8.67 TCP 54 38988→80 [ACK] Seq=112 Ack=10011 Win=3089920 Len=0
 18 0.120574000 172.217.8.67 -> 10.0.2.15    TCP 1484 [TCP segment of a reassembled PDU]
 19 0.120582000    10.0.2.15 -> 172.217.8.67 TCP 54 38988→80 [ACK] Seq=112 Ack=11441 Win=3271680 Len=0
 20 0.122505000 172.217.8.67 -> 10.0.2.15    TCP 1279 [TCP segment of a reassembled PDU]
 21 0.122513000    10.0.2.15 -> 172.217.8.67 TCP 54 38988→80 [ACK] Seq=112 Ack=12666 Win=3453440 Len=0
 22 0.124403000 172.217.8.67 -> 10.0.2.15    HTTP 60 HTTP/1.1 200 OK  (text/html)
 23 0.124415000    10.0.2.15 -> 172.217.8.67 TCP 54 38988→80 [ACK] Seq=112 Ack=12671 Win=3453440 Len=0
 24 0.125690000    10.0.2.15 -> 172.217.8.67 TCP 54 38988→80 [FIN, ACK] Seq=112 Ack=12671 Win=3453440 Len=0
 25 0.127339000 172.217.8.67 -> 10.0.2.15    TCP 60 80→38988 [ACK] Seq=12671 Ack=113 Win=65535 Len=0
 26 0.159468000 172.217.8.67 -> 10.0.2.15    TCP 60 80→38988 [FIN, ACK] Seq=12671 Ack=113 Win=65535 Len=0
 27 0.159506000    10.0.2.15 -> 172.217.8.67 TCP 54 38988→80 [ACK] Seq=113 Ack=12672 Win=3453440 Len=0
