vagrant@webserver:~$ tshark -r /vagrant/webserver-eth0-traffic4.pcap
  1 0.000000000    10.0.2.15 -> 212.58.244.68 TCP 74 38843→80 [SYN] Seq=0 Win=29200 Len=0 MSS=1460 SACK_PERM=1 TSval=4546501 TSecr=0 WS=64
  2 0.135628000 212.58.244.68 -> 10.0.2.15    TCP 60 80→38843 [SYN, ACK] Seq=0 Ack=1 Win=65535 Len=0 MSS=1460
  3 0.135700000    10.0.2.15 -> 212.58.244.68 TCP 54 38843→80 [ACK] Seq=1 Ack=1 Win=1868800 Len=0
  4 0.136611000    10.0.2.15 -> 212.58.244.68 HTTP 165 GET / HTTP/1.1
  5 0.138492000 212.58.244.68 -> 10.0.2.15    TCP 60 80→38843 [ACK] Seq=1 Ack=112 Win=65535 Len=0
  6 0.404321000 212.58.244.68 -> 10.0.2.15    HTTP 556 HTTP/1.1 301 Moved Permanently  (text/html)
  7 0.404349000    10.0.2.15 -> 212.58.244.68 TCP 54 38843→80 [ACK] Seq=112 Ack=503 Win=1921024 Len=0
  8 1.264838000    10.0.2.15 -> 212.58.244.68 TCP 54 38843→80 [FIN, ACK] Seq=112 Ack=503 Win=1921024 Len=0
  9 1.265158000 212.58.244.68 -> 10.0.2.15    TCP 60 80→38843 [ACK] Seq=503 Ack=113 Win=65535 Len=0
 10 1.399357000 212.58.244.68 -> 10.0.2.15    TCP 60 80→38843 [FIN, ACK] Seq=503 Ack=113 Win=65535 Len=0
 11 1.399372000    10.0.2.15 -> 212.58.244.68 TCP 54 38843→80 [ACK] Seq=113 Ack=504 Win=1921024 Len=0
 12 104.451950000    10.0.2.15 -> 104.20.228.9 TCP 74 54617→80 [SYN] Seq=0 Win=29200 Len=0 MSS=1460 SACK_PERM=1 TSval=4572614 TSecr=0 WS=64
 13 104.486138000 104.20.228.9 -> 10.0.2.15    TCP 60 80→54617 [SYN, ACK] Seq=0 Ack=1 Win=65535 Len=0 MSS=1460
 14 104.486173000    10.0.2.15 -> 104.20.228.9 TCP 54 54617→80 [ACK] Seq=1 Ack=1 Win=1868800 Len=0
 15 104.486320000    10.0.2.15 -> 104.20.228.9 HTTP 162 GET / HTTP/1.1
 16 104.486729000 104.20.228.9 -> 10.0.2.15    TCP 60 80→54617 [ACK] Seq=1 Ack=109 Win=65535 Len=0
 17 105.224333000 104.20.228.9 -> 10.0.2.15    HTTP 332 HTTP/1.1 301 Moved Permanently
 18 105.224446000    10.0.2.15 -> 104.20.228.9 TCP 54 54617→80 [ACK] Seq=109 Ack=279 Win=1921024 Len=0
 19 108.697630000    10.0.2.15 -> 104.20.228.9 TCP 54 54617→80 [FIN, ACK] Seq=109 Ack=279 Win=1921024 Len=0
 20 108.697865000 104.20.228.9 -> 10.0.2.15    TCP 60 80→54617 [ACK] Seq=279 Ack=110 Win=65535 Len=0
 21 108.729774000 104.20.228.9 -> 10.0.2.15    TCP 60 80→54617 [FIN, ACK] Seq=279 Ack=110 Win=65535 Len=0
 22 108.729830000    10.0.2.15 -> 104.20.228.9 TCP 54 54617→80 [ACK] Seq=110 Ack=280 Win=1921024 Len=0
 23 140.916129000    10.0.2.15 -> 74.6.136.151 TCP 74 36265→80 [SYN] Seq=0 Win=29200 Len=0 MSS=1460 SACK_PERM=1 TSval=4581730 TSecr=0 WS=64
 24 140.994087000 74.6.136.151 -> 10.0.2.15    TCP 60 80→36265 [SYN, ACK] Seq=0 Ack=1 Win=65535 Len=0 MSS=1460
 25 140.994135000    10.0.2.15 -> 74.6.136.151 TCP 54 36265→80 [ACK] Seq=1 Ack=1 Win=1868800 Len=0
 26 140.994795000    10.0.2.15 -> 74.6.136.151 HTTP 164 GET / HTTP/1.1
 27 140.995242000 74.6.136.151 -> 10.0.2.15    TCP 60 80→36265 [ACK] Seq=1 Ack=111 Win=65535 Len=0
 28 141.745204000 74.6.136.151 -> 10.0.2.15    HTTP 807 HTTP/1.1 301 Moved Permanently
 29 141.745264000    10.0.2.15 -> 74.6.136.151 TCP 54 36265→80 [ACK] Seq=111 Ack=754 Win=1927680 Len=0
 30 141.768793000    10.0.2.15 -> 72.30.35.9   TCP 74 44960→80 [SYN] Seq=0 Win=29200 Len=0 MSS=1460 SACK_PERM=1 TSval=4581943 TSecr=0 WS=64
 31 141.851833000   72.30.35.9 -> 10.0.2.15    TCP 60 80→44960 [SYN, ACK] Seq=0 Ack=1 Win=65535 Len=0 MSS=1460
 32 141.851887000    10.0.2.15 -> 72.30.35.9   TCP 54 44960→80 [ACK] Seq=1 Ack=1 Win=1868800 Len=0
 33 141.852583000    10.0.2.15 -> 72.30.35.9   HTTP 164 GET / HTTP/1.1
 34 141.852937000   72.30.35.9 -> 10.0.2.15    TCP 60 80→44960 [ACK] Seq=1 Ack=111 Win=65535 Len=0
 35 142.579626000   72.30.35.9 -> 10.0.2.15    HTTP 673 HTTP/1.1 301 Moved Permanently  (text/html)
 36 142.579737000    10.0.2.15 -> 72.30.35.9   TCP 54 44960→80 [ACK] Seq=111 Ack=620 Win=1941184 Len=0
 37 142.581002000    10.0.2.15 -> 74.6.136.151 TCP 54 36265→80 [FIN, ACK] Seq=111 Ack=754 Win=1927680 Len=0
 38 142.581557000 74.6.136.151 -> 10.0.2.15    TCP 60 80→36265 [ACK] Seq=754 Ack=112 Win=65535 Len=0
 39 142.654472000 74.6.136.151 -> 10.0.2.15    TCP 60 80→36265 [FIN, ACK] Seq=754 Ack=112 Win=65535 Len=0
 40 142.654529000    10.0.2.15 -> 74.6.136.151 TCP 54 36265→80 [ACK] Seq=112 Ack=755 Win=1927680 Len=0
 41 145.086540000    10.0.2.15 -> 72.30.35.9   TCP 54 44960→80 [FIN, ACK] Seq=111 Ack=620 Win=1941184 Len=0
 42 145.087193000   72.30.35.9 -> 10.0.2.15    TCP 60 80→44960 [ACK] Seq=620 Ack=112 Win=65535 Len=0
 43 145.165417000   72.30.35.9 -> 10.0.2.15    TCP 60 80→44960 [FIN, ACK] Seq=620 Ack=112 Win=65535 Len=0
 44 145.165478000    10.0.2.15 -> 72.30.35.9   TCP 54 44960→80 [ACK] Seq=112 Ack=621 Win=1941184 Len=0
 45 200.090971000    10.0.2.15 -> 90.216.128.5 TCP 74 56991→80 [SYN] Seq=0 Win=29200 Len=0 MSS=1460 SACK_PERM=1 TSval=4596523 TSecr=0 WS=64
 46 200.234570000 90.216.128.5 -> 10.0.2.15    TCP 60 80→56991 [SYN, ACK] Seq=0 Ack=1 Win=65535 Len=0 MSS=1460
 47 200.234644000    10.0.2.15 -> 90.216.128.5 TCP 54 56991→80 [ACK] Seq=1 Ack=1 Win=1868800 Len=0
 48 200.236646000    10.0.2.15 -> 90.216.128.5 HTTP 167 GET / HTTP/1.1
 49 200.237330000 90.216.128.5 -> 10.0.2.15    TCP 60 80→56991 [ACK] Seq=1 Ack=114 Win=65535 Len=0
 50 200.945461000 90.216.128.5 -> 10.0.2.15    HTTP 524 HTTP/1.1 301 Moved Permanently  (text/html)
 51 200.945519000    10.0.2.15 -> 90.216.128.5 TCP 54 56991→80 [ACK] Seq=114 Ack=471 Win=1921024 Len=0
 52 202.860925000    10.0.2.15 -> 90.216.128.5 TCP 54 56991→80 [FIN, ACK] Seq=114 Ack=471 Win=1921024 Len=0
 53 202.861020000 90.216.128.5 -> 10.0.2.15    TCP 60 80→56991 [ACK] Seq=471 Ack=115 Win=65535 Len=0
 54 203.007236000 90.216.128.5 -> 10.0.2.15    TCP 60 80→56991 [FIN, ACK] Seq=471 Ack=115 Win=65535 Len=0
 55 203.007302000    10.0.2.15 -> 90.216.128.5 TCP 54 56991→80 [ACK] Seq=115 Ack=472 Win=1921024 Len=0
 56 258.396837000    10.0.2.15 -> 151.101.5.73 TCP 74 46823→80 [SYN] Seq=0 Win=29200 Len=0 MSS=1460 SACK_PERM=1 TSval=4611100 TSecr=0 WS=64
 57 258.427814000 151.101.5.73 -> 10.0.2.15    TCP 60 80→46823 [SYN, ACK] Seq=0 Ack=1 Win=65535 Len=0 MSS=1460
 58 258.427845000    10.0.2.15 -> 151.101.5.73 TCP 54 46823→80 [ACK] Seq=1 Ack=1 Win=1868800 Len=0
 59 258.428300000    10.0.2.15 -> 151.101.5.73 HTTP 169 GET / HTTP/1.1
 60 258.428615000 151.101.5.73 -> 10.0.2.15    TCP 60 80→46823 [ACK] Seq=1 Ack=116 Win=65535 Len=0
 61 258.691828000 151.101.5.73 -> 10.0.2.15    HTTP 634 HTTP/1.1 301 Moved Permanently  (text/html)
 62 258.691862000    10.0.2.15 -> 151.101.5.73 TCP 54 46823→80 [ACK] Seq=116 Ack=581 Win=1930240 Len=0
 63 259.318370000    10.0.2.15 -> 151.101.5.73 TCP 54 46823→80 [FIN, ACK] Seq=116 Ack=581 Win=1930240 Len=0
 64 259.318830000 151.101.5.73 -> 10.0.2.15    TCP 60 80→46823 [ACK] Seq=581 Ack=117 Win=65535 Len=0
 65 259.357490000 151.101.5.73 -> 10.0.2.15    TCP 60 80→46823 [FIN, ACK] Seq=581 Ack=117 Win=65535 Len=0
 66 259.357533000    10.0.2.15 -> 151.101.5.73 TCP 54 46823→80 [ACK] Seq=117 Ack=582 Win=1930240 Len=0
